[
  {
    "id": "h1",
    "name": "Main Hall",
    "location": "Hlavní pavilon festivalového areálu",
    "capacity": 5000,
    "description": "Světová jména popu, rocku a taneční hudby v hlavním pavilonu návrhu festivalového areálu. Zde hrají hlavní hvězdy večerního programu.",
    "ticketing": {
      "standingCapacity": 4952,
      "seats": {
        "vip": {
          "rows": [
            "A",
            "B"
          ],
          "perRow": 8
        },
        "regular": {
          "rows": [
            "C",
            "D",
            "E",
            "F"
          ],
          "perRow": 8
        }
      },
      "prices": {
        "vip": {
          "day": 490,
          "festival": 1290
        },
        "regular": {
          "day": 290,
          "festival": 790
        },
        "standing": {
          "day": 150,
          "festival": 390
        }
      }
    }
  },
  {
    "id": "h2",
    "name": "River Stage",
    "location": "Venkovní scéna u Vltavy",
    "capacity": 3000,
    "description": "Venkovní scéna u Vltavy v navrženém širším festivalovém areálu. Program patří českému rapu, pop rocku a domácím kapelám.",
    "ticketing": {
      "standingCapacity": 3000,
      "seats": {},
      "prices": {
        "standing": {
          "day": 110,
          "festival": 290
        }
      }
    }
  },
  {
    "id": "h3",
    "name": "Club Stage",
    "location": "Klubový pavilon festivalového areálu",
    "capacity": 1500,
    "description": "Klubová scéna pro drum and bass, UK garage, bassline a hard techno. Program propojuje britskou basovou scénu s taneční elektronikou.",
    "ticketing": {
      "standingCapacity": 1500,
      "seats": {},
      "prices": {
        "standing": {
          "day": 90,
          "festival": 240
        }
      }
    }
  }
]
